{
    "componentChunkName": "component---src-templates-project-js",
    "path": "/projects/the-lemon-press",
    "result": {"data":{"mdx":{"body":"var _excluded = [\"components\"];\n\nfunction _extends() { _extends = Object.assign || function (target) { for (var i = 1; i < arguments.length; i++) { var source = arguments[i]; for (var key in source) { if (Object.prototype.hasOwnProperty.call(source, key)) { target[key] = source[key]; } } } return target; }; return _extends.apply(this, arguments); }\n\nfunction _objectWithoutProperties(source, excluded) { if (source == null) return {}; var target = _objectWithoutPropertiesLoose(source, excluded); var key, i; if (Object.getOwnPropertySymbols) { var sourceSymbolKeys = Object.getOwnPropertySymbols(source); for (i = 0; i < sourceSymbolKeys.length; i++) { key = sourceSymbolKeys[i]; if (excluded.indexOf(key) >= 0) continue; if (!Object.prototype.propertyIsEnumerable.call(source, key)) continue; target[key] = source[key]; } } return target; }\n\nfunction _objectWithoutPropertiesLoose(source, excluded) { if (source == null) return {}; var target = {}; var sourceKeys = Object.keys(source); var key, i; for (i = 0; i < sourceKeys.length; i++) { key = sourceKeys[i]; if (excluded.indexOf(key) >= 0) continue; target[key] = source[key]; } return target; }\n\n/* @jsxRuntime classic */\n\n/* @jsx mdx */\nvar _frontmatter = {\n  \"slug\": \"/projects/the-lemon-press\",\n  \"date\": \"2021-04-01\",\n  \"title\": \"The Lemon Press\",\n  \"preview\": \"../../images/Projects/LemonPress/preview.png\",\n  \"client\": \"The Lemon Press\",\n  \"description\": \"We made a new website for the on campus satirical magazine 'The Lemon Press', mostly so they didn't write any articles about us\",\n  \"lead\": \"Adam Barr\",\n  \"developers\": [\"Ben Silverman\", \"Harry Wickham\"],\n  \"link\": \"https://thelemonpress.co.uk\"\n};\nvar layoutProps = {\n  _frontmatter: _frontmatter\n};\nvar MDXLayout = \"wrapper\";\nreturn function MDXContent(_ref) {\n  var components = _ref.components,\n      props = _objectWithoutProperties(_ref, _excluded);\n\n  return mdx(MDXLayout, _extends({}, layoutProps, props, {\n    components: components,\n    mdxType: \"MDXLayout\"\n  }), mdx(\"hr\", null), mdx(\"h1\", null, \"The Lemon Press Website\"), mdx(\"p\", null, \"When the University of Yorks most famous (and only) satirical print magazine approached us for help designing and creating a new website for them, we knew we couldn\\u2019t say no, mostly because of the satirical articles we were scared they could write satirical articles about us.\"), mdx(\"p\", null, \"The final website can be found at \", mdx(\"a\", {\n    parentName: \"p\",\n    \"href\": \"https://thelemonpress.co.uk\",\n    \"target\": \"_blank\",\n    \"rel\": \"nofollow noopener noreferrer\"\n  }, \"https://thelemonpress.co.uk\"), \", it is a static site built using the Gatsby framework, sourcing its content from a WordPress instance and the issuu.com API. This solution provides fast load times and high ranking SEO performance along with incredibly cheap hosting using a reliable CMS that we didn\\u2019t have to design ourselves. The site itself is hosted using GitHub Pages and rebuilds itself on a regular basis to ensure it always provides the freshest available content.\"), mdx(\"p\", null, \"We used Gatsby to build the site, an open-source javascript framework based on React. Gatsby was chosen as it is designed to build static sites that load fast, and has extensive support for sourcing content from different sources.\"), mdx(\"p\", null, \"The \", mdx(\"a\", {\n    parentName: \"p\",\n    \"href\": \"https://www.gatsbyjs.com/plugins/gatsby-source-wordpress/\",\n    \"target\": \"_blank\",\n    \"rel\": \"nofollow noopener noreferrer\"\n  }, \"gatsby-source-wordpress\"), \" plugin allowed us to easily query the WordPress instance to collect the relevant content for pages. For development purposes, we created a digital ocean droplet with a WordPress instance running on it, however the final deployed site source from a BlueHost instance, as it\\u2019s more stable and has more support for when things go wrong. We tried to give as much freedom to the lemon press team as possible, by sourcing all of our tags and featured content from WordPress.\"), mdx(\"p\", null, \"The \", mdx(\"a\", {\n    parentName: \"p\",\n    \"href\": \"https://thelemonpress.co.uk/print-issues\",\n    \"target\": \"_blank\",\n    \"rel\": \"nofollow noopener noreferrer\"\n  }, \"Print Issues\"), \" page is a completely bespoke page that wouldn\\u2019t be possible to create using any off the shelf website builders, the content is sourced from the issuu.com API, and by using the \", mdx(\"a\", {\n    parentName: \"p\",\n    \"href\": \"https://www.gatsbyjs.com/plugins/gatsby-source-rest-api/\",\n    \"target\": \"_blank\",\n    \"rel\": \"nofollow noopener noreferrer\"\n  }, \"gatsby-source-rest-api\"), \" we could query content and create pages in much the same way as WordPress. The page itself is simply a responsive CSS grid, where the columns will auto-size to best fit on the screen no matter its size, we are (I am) pretty proud of how it turned out\\uD83D\\uDE0F.\"), mdx(\"p\", null, \"GitHub Actions are used to deploy the site, there are two reasons the site could be redeployed, the most common being that the scheduled cron job is run to rebuild the live site so the content on it re-fetched from WordPress and is up to date, the second is on any push to the main branch. The build time is steadily increasing as the site grows, however, Gatsby does allow us to cache previous builds so pages that haven\\u2019t changed don\\u2019t need to be built from scratch.\"), mdx(\"p\", null, \"If you want to learn more about how we made this site or find out how to make a website like it yourself, join our discord to say hello and find out more about what we\\u2019re up to: \", mdx(\"a\", {\n    parentName: \"p\",\n    \"href\": \"https://discord.gg/j8fbqEP2TD\",\n    \"target\": \"_blank\",\n    \"rel\": \"nofollow noopener noreferrer\"\n  }, \"https://discord.gg/j8fbqEP2TD\"), \" \"));\n}\n;\nMDXContent.isMDXComponent = true;","frontmatter":{"date":"April 01, 2021","slug":"/projects/the-lemon-press","title":"The Lemon Press","client":"The Lemon Press","description":"We made a new website for the on campus satirical magazine 'The Lemon Press', mostly so they didn't write any articles about us","lead":"Adam Barr","developers":["Ben Silverman","Harry Wickham"],"link":"https://thelemonpress.co.uk"}}},"pageContext":{"slug":"/projects/the-lemon-press"}},
    "staticQueryHashes": ["4202924991"]}